{
  "queue_id": "QUEUE-PIT-MODERN-2026-DOGE-MUSK-EXPOSURE",
  "topic_id": "PIT-MODERN-2026-DOGE-MUSK-EXPOSURE",
  "queue_status": "active",
  "created_date": "2026-07-16",
  "last_reviewed": "2026-07-16",
  "notes": "Primary-record queue for testing budget, enforcement, ethics, waiver, and causation claims without promoting unverified legal conclusions.",
  "items": [
    {
      "intake_id": "DOGE-MUSK-INTAKE-001",
      "record_class": "SGE appointment instrument and duty description",
      "likely_custodians": ["White House", "Office of Personnel Management", "appointing office"],
      "affected_branches": ["influence_lineage", "action_conversion", "ledger_classification"],
      "state": "requested",
      "activation_effect": "Defines role, dates, authority, and whether specific participation was possible.",
      "privacy_posture": "public",
      "priority": "critical",
      "source_receipt_ids": [],
      "notes": "Obtain the signed or official appointment record rather than relying on role descriptions alone."
    },
    {
      "intake_id": "DOGE-MUSK-INTAKE-002",
      "record_class": "18 U.S.C. § 208(b) waiver, ethics agreement, and recusal instruments",
      "likely_custodians": ["White House Counsel", "Office of Government Ethics", "designated agency ethics official"],
      "affected_branches": ["factual_basis", "action_conversion", "institutional_response", "ledger_classification"],
      "state": "requested",
      "activation_effect": "Resolves the principal statutory hinge and scope of any preauthorized participation.",
      "privacy_posture": "public",
      "priority": "critical",
      "source_receipt_ids": [],
      "notes": "Absence must not be inferred from failure to locate without a reproducible search and custodian response."
    },
    {
      "intake_id": "DOGE-MUSK-INTAKE-003",
      "record_class": "SEC v. Musk docket and settlement approval record",
      "likely_custodians": ["United States District Court for the District of Columbia", "SEC"],
      "affected_branches": ["court_records", "institutional_response", "outcome_evidence"],
      "state": "located",
      "activation_effect": "Updates the narrative from pending litigation to the exact current judicial posture.",
      "privacy_posture": "public",
      "priority": "critical",
      "source_receipt_ids": ["SRC-2026-SEC-MUSK-SETTLEMENT-REUTERS-001"],
      "notes": "Reuters confirms a proposed settlement and judicial scrutiny as of May 8, 2026; the final docket order remains required."
    },
    {
      "intake_id": "DOGE-MUSK-INTAKE-004",
      "record_class": "SpaceX hiring-discrimination docket and dismissal order",
      "likely_custodians": ["Department of Justice", "adjudicating federal court"],
      "affected_branches": ["court_records", "institutional_response", "outcome_evidence"],
      "state": "requested",
      "activation_effect": "Establishes filing, dismissal date, prejudice status, and stated basis from primary records.",
      "privacy_posture": "public",
      "priority": "high",
      "source_receipt_ids": [],
      "notes": "Install the notice and signed order separately."
    },
    {
      "intake_id": "DOGE-MUSK-INTAKE-005",
      "record_class": "NLRB dockets and current dispositions involving SpaceX, Tesla, and X",
      "likely_custodians": ["National Labor Relations Board", "federal appellate courts"],
      "affected_branches": ["enforcement_records", "institutional_response", "outcome_evidence"],
      "state": "requested",
      "activation_effect": "Replaces aggregate matter counts and pause claims with case-level current status.",
      "privacy_posture": "public",
      "priority": "high",
      "source_receipt_ids": [],
      "notes": "Record each matter separately; do not collapse constitutional challenges, settlements, stays, and dismissals."
    },
    {
      "intake_id": "DOGE-MUSK-INTAKE-006",
      "record_class": "FAA penalties, staffing changes, and Starlink procurement record",
      "likely_custodians": ["Federal Aviation Administration", "Department of Transportation", "contracting office", "GAO"],
      "affected_branches": ["enforcement_records", "action_conversion", "outcome_evidence"],
      "state": "requested",
      "activation_effect": "Tests whether enforcement and procurement changes were connected or merely contemporaneous.",
      "privacy_posture": "public",
      "priority": "high",
      "source_receipt_ids": [],
      "notes": "Separate workforce totals, penalty disposition, procurement competition, and decision authority."
    },
    {
      "intake_id": "DOGE-MUSK-INTAKE-007",
      "record_class": "OFCCP and NHTSA investigation-status records",
      "likely_custodians": ["Department of Labor", "OFCCP", "NHTSA", "Department of Transportation"],
      "affected_branches": ["enforcement_records", "institutional_response", "outcome_evidence"],
      "state": "requested",
      "activation_effect": "Determines whether investigations were closed, delayed, transferred, or remained active.",
      "privacy_posture": "public",
      "priority": "high",
      "source_receipt_ids": [],
      "notes": "Workforce reduction alone does not establish a matter-specific disposition."
    },
    {
      "intake_id": "DOGE-MUSK-INTAKE-008",
      "record_class": "Inspector-general removal and affected-investigation records",
      "likely_custodians": ["White House", "Congress", "Council of the Inspectors General on Integrity and Efficiency", "affected OIGs"],
      "affected_branches": ["influence_lineage", "action_conversion", "institutional_response"],
      "state": "requested",
      "activation_effect": "Tests timing, statutory notice, stated reasons, and whether Musk-company matters were active and affected.",
      "privacy_posture": "public",
      "priority": "critical",
      "source_receipt_ids": [],
      "notes": "Do not infer all removals concerned Musk entities; identify each office and investigation."
    },
    {
      "intake_id": "DOGE-MUSK-INTAKE-009",
      "record_class": "DOGE savings, fraud, cancellation, and correction ledger",
      "likely_custodians": ["United States DOGE Service", "Office of Management and Budget", "affected agencies"],
      "affected_branches": ["factual_basis", "claimed_justification", "outcome_evidence"],
      "state": "requested",
      "activation_effect": "Separates claimed, duplicated, corrected, announced, and realized savings and distinguishes fraud from other categories.",
      "privacy_posture": "public",
      "priority": "critical",
      "source_receipt_ids": [],
      "notes": "Preserve version history and correction dates."
    },
    {
      "intake_id": "DOGE-MUSK-INTAKE-010",
      "record_class": "FY2025 actual and FY2026 requested, enacted, and projected budget records",
      "likely_custodians": ["Treasury", "Congressional Budget Office", "Office of Management and Budget", "Congress"],
      "affected_branches": ["budget_records", "claimed_justification", "outcome_evidence", "control_comparison"],
      "state": "requested",
      "activation_effect": "Permits comparable aggregate and program-level measurement without mixing accounting stages.",
      "privacy_posture": "public",
      "priority": "critical",
      "source_receipt_ids": [],
      "notes": "Label every figure as requested, enacted, obligated, expended, actual, or projected."
    },
    {
      "intake_id": "DOGE-MUSK-INTAKE-011",
      "record_class": "FEC and state election-enforcement matters involving America PAC",
      "likely_custodians": ["Federal Election Commission", "state election agencies", "state courts and prosecutors"],
      "affected_branches": ["funding_or_donor_links", "institutional_response", "outcome_evidence"],
      "state": "requested",
      "activation_effect": "Separates federal campaign-finance matters from state lottery, bribery, and election-law matters.",
      "privacy_posture": "public",
      "priority": "medium",
      "source_receipt_ids": [],
      "notes": "A July 2026 Wisconsin probable-cause referral is adjacent but not a substitute for FEC disposition records."
    },
    {
      "intake_id": "DOGE-MUSK-INTAKE-012",
      "record_class": "Historical control set for officials with private-company federal exposure",
      "likely_custodians": ["Office of Government Ethics", "Congressional Research Service", "agency ethics offices", "federal court archives"],
      "affected_branches": ["control_comparison", "ledger_classification"],
      "state": "requested",
      "activation_effect": "Tests claims of novelty and whether the observed convergence is exceptional.",
      "privacy_posture": "public",
      "priority": "high",
      "source_receipt_ids": [],
      "notes": "Document search protocol, inclusion criteria, negative results, and near controls."
    }
  ]
}
